<?xml version="1.0" encoding="UTF-8"?>
<xs:schema xmlns:xs="http://www.w3.org/2001/XMLSchema">
    
    <xs:element name="r">
        <xs:complexType>
            <xs:sequence>
                <xs:element name="n" type="xs:int"/>
                <xs:choice minOccurs="0" maxOccurs="unbounded">
                    <xs:element name="a" type="t"/>
                    <xs:element name="b" type="t"/>
                    <xs:element name="c" type="t"/>
                    <xs:element name="d" type="t"/>
                </xs:choice>
            </xs:sequence>
        </xs:complexType>
    </xs:element>
    
    <xs:complexType name="t">
        <xs:sequence>
            <xs:element name="n" type="xs:int"/>
            <xs:choice minOccurs="0" maxOccurs="unbounded">
                <xs:element name="a" type="t"/>
                <xs:element name="b" type="t"/>
                <xs:element name="c" type="t"/>
                <xs:element name="d" type="t"/>
            </xs:choice>
        </xs:sequence>
    </xs:complexType>
    
</xs:schema>
