<r xmlns:xsi="http://www.w3.org/2001/XMLSchema-instance"
 xsi:noNamespaceSchemaLocation="root.xsd">
    <n>1</n>
    <b>
        <n>5</n>
        <c>
            <n>3</n>
        </c>
        <d>
            <n>4</n>
        </d>
    </b>
    <b>
        <n>6</n>
        <d>
            <n>4</n>
        </d>
        <c>
            <n>3</n>
        </c> <!-- Wrong order, this <b> is ignored -->
    </b>
    <b>
        <n>7</n>
        <c>
            <n>3</n>
        </c>
        <d>
            <n>4</n>
        </d>
    </b>
</r>
